{
  "_meta": {
    "file": "anticheat.json",
    "version": 1,
    "owner": "systems-designer",
    "task": "P1-F03-T06",
    "doc": "design/systems/balance-model.md section 12",
    "_note": "Movement gate lives in dungeons.json#movementGate (single source). All checks run on the server"
  },
  "checkIn": {
    "_source": "GDD > Anti-cheat > มาตรการเป็นชั้น > ชั้น 1 (GPS sample ต่อเนื่องอย่างน้อย 60 วินาทีที่เดินเข้ามาจากข้างนอก, accuracy น้อยกว่า 30 เมตร)",
    "minContinuousApproach_s": 60,
    "maxAccuracy_m": 30,
    "teleportIntoPolygonAllowed": false,
    "_note": "P2-F05-T20 review: values unchanged. maxAccuracy_m is compared strictly (accuracy < 30 passes, 30 is rejected, spec F04 E6). 'Continuous' = no sample pair further apart than dungeons.json#movementGate.maxSamplePairGap_s, no sample dropped by the gate outlier filter (movementGate.maxSampleAccuracy_m, outlierSpeed_kmh) and no sample while speed-locked (tech note F04 7.2-7.3). The approach must contain a usable sample outside the selected polygon and end on a sample inside it. Vectors: design/systems/test-vectors/check-in.json"
  },
  "speedLock": {
    "_source": "GDD > Anti-cheat > ชั้น 1; ความปลอดภัยผู้เล่นและ PDPA > ความปลอดภัยทางกายภาพ (speed lock 25 กม./ชม. ล็อกการเล่น ไม่ใช่แค่เตือน)",
    "speedLock_kmh": 25,
    "action": "lockPlay",
    "lockSustained_s": 15,
    "unlockSustained_s": 60,
    "_sustained_source": "P2-F05-T20 · spec F04 R20 (lock before a car is at full speed, but a single GPS spike must not lock a walker) and R22 (unlock after longer than one red light). Speed = unfiltered pairs with accuracy <= movementGate.maxSampleAccuracy_m; a pair gap > movementGate.maxSamplePairGap_s breaks the run. lockSustained_s 15: a one-fix spike gives two fast pairs spanning 2 s at 1 Hz and 10 s at 0.2 Hz, both below 15; synthetic-driving-40kmh-01 locks at 84 s (the car passes 25 km/h at about 80 s). unlockSustained_s 60: the 45 s red light of the same trace stays locked. Both transitions are back-dated to the first sample of the run (tech note F04 6, D-094), so the long unlock costs no reward-clock time. Evidence: tools/sim report-gate section 4",
    "_assumption": "A-P2-F05-T20-2: 15 s / 60 s are proposals from synthetic traces. Bangkok red lights are often longer than 60 s, so the lock may drop and return at a long light; harmless because both edges are back-dated and a stopped car adds no distance. Owner: game-director (safety intent), systems-designer (values)"
  },
  "offlineEvidence": {
    "_source": "GDD > สถาปัตยกรรมเทคนิค > สัญญาณขาดและแอปถูกปิด (sample ที่ upload ทีหลังมีน้ำหนักต่ำกว่าใน trust score)",
    "seeMaxAge": "dungeons.json#offlineEvidence.maxOfflineEvidenceAge_s",
    "trustWeightVsLive": 0.5,
    "_assumption": "A-P1-F03-T06-21: GDD says 'lower weight' without a number. Late-uploaded samples count 0.5 of a live sample in trust scoring. Owner: backend-programmer, tech-lead"
  },
  "trustScore": {
    "_source": "GDD > Anti-cheat > มาตรการเป็นชั้น > ชั้น 4 (score ต่ำทำให้ drop แย่ลง ของ rare ไม่ออก trade ไม่ได้)",
    "min": 0,
    "max": 100,
    "initial": 70,
    "lowThreshold": 40,
    "lowTrustCanTrade": false,
    "seeDropEffect": "drops.json#multipliers.lowTrustMult",
    "_assumption": "A-P1-F03-T06-11: GDD gives no scale or threshold. Scale 0-100, new accounts start at 70, below 40 = low trust. Owner: game-director, backend-programmer"
  },
  "outputAudit": {
    "_source": "GDD > Anti-cheat > มาตรการเป็นชั้น > ชั้น 5 (บัญชีที่ผลิตเกิน p99 ของ cohort เดียวกันติดต่อกันให้ตั้งธง)",
    "flagPercentile": 99,
    "consecutiveDaysToFlag": 3,
    "_assumption": "A-P1-F03-T06-21b: 'ติดต่อกัน' = 3 days in a row. Owner: liveops-operator"
  }
}
